{
  "$schema": "../schemas/character-relationship-benchmark.schema.json",
  "required_genres": ["mystery", "romance", "fantasy"],
  "required_target_readers": ["webnovel-core"],
  "required_relationship_types": ["ally", "rivalry", "romance"],
  "minimum_panel_size": 3,
  "minimum_commented_responses": 2,
  "minimum_samples_per_genre": 2,
  "minimum_samples_per_target_reader": 2,
  "minimum_samples_per_relationship_type": 2,
  "minimum_holdout_samples": 1,
  "minimum_usable_holdout_samples": 1,
  "minimum_failing_holdout_samples": 1,
  "minimum_usable_failing_holdout_samples": 1,
  "require_focus_evidence": true,
  "samples": [
    {
      "id": "character-relationship-good-ally",
      "label": "타깃 독자가 인물과 관계 전환을 따라가고 싶다고 반응한 장면",
      "genre": "mystery",
      "target_reader": "webnovel-core",
      "chapter": 4,
      "focus": {
        "character_id": "protagonist",
        "character_name": "주인공",
        "relationship_id": "protagonist_partner",
        "relationship_type": "ally",
        "counterpart_id": "partner",
        "counterpart_name": "파트너",
        "scene_promise": "주인공이 숨긴 단서를 공개하면 파트너의 신뢰를 얻지만 자기 약점도 드러난다.",
        "character_appeal_moment": "주인공은 안전한 침묵 대신 피해자를 구할 단서 공개를 택한다.",
        "relationship_turn": "파트너는 조건부 협력을 제안하고, 둘의 거리는 경계에서 임시 동맹으로 바뀐다.",
        "intended_change": "다음 장면부터 파트너가 정보를 숨기지 않지만 주인공의 거짓말도 감시한다.",
        "consequence": "주인공의 가족 실종 파일이 수사팀에 노출될 위험이 생긴다."
      },
      "automated_score": 92,
      "expected_investing": true,
      "calibration_split": "calibration",
      "rating_scale": "likert-7",
      "reader_responses": [
        {
          "reader_id": "reader-001",
          "target_reader_fit": true,
          "ratings": {
            "protagonist_agency": 7,
            "distinctive_signature": 6,
            "vulnerability_cost": 6,
            "character_attachment": 6,
            "relationship_tension": 6,
            "reciprocal_pressure": 6,
            "subtext_inference": 6,
            "turn_consequence": 7,
            "next_scene_interest": 7
          },
          "would_follow_character": true,
          "would_follow_relationship": true,
          "would_continue_score": 7,
          "comment": "주인공이 단서를 공개해서 손해를 감수하는 선택이 보여 다음 협력이 궁금하다.",
          "care_points": ["단서 공개의 대가", "조건부 동맹"],
          "rewrite_suggestion": "파트너가 제시하는 조건을 한 문장 더 날카롭게 만들면 긴장이 강해진다."
        },
        {
          "reader_id": "reader-002",
          "target_reader_fit": true,
          "ratings": {
            "protagonist_agency": 6,
            "distinctive_signature": 6,
            "vulnerability_cost": 6,
            "character_attachment": 6,
            "relationship_tension": 7,
            "reciprocal_pressure": 6,
            "subtext_inference": 5,
            "turn_consequence": 6,
            "next_scene_interest": 6
          },
          "would_follow_character": true,
          "would_follow_relationship": true,
          "would_continue_score": 6,
          "comment": "둘이 그냥 친해지는 게 아니라 서로 감시하는 동맹이라 관계가 살아 있다.",
          "care_points": ["감시가 붙은 협력", "숨긴 가족 파일"],
          "rewrite_suggestion": "침묵이나 시선 같은 속내 단서가 더 있으면 좋다."
        },
        {
          "reader_id": "reader-003",
          "target_reader_fit": true,
          "ratings": {
            "protagonist_agency": 7,
            "distinctive_signature": 5,
            "vulnerability_cost": 6,
            "character_attachment": 6,
            "relationship_tension": 6,
            "reciprocal_pressure": 6,
            "subtext_inference": 6,
            "turn_consequence": 6,
            "next_scene_interest": 7
          },
          "would_follow_character": true,
          "would_follow_relationship": true,
          "would_continue_score": 7,
          "comment": "주인공이 잃을 게 생겨서 다음 장면에서 파트너와 어떻게 움직일지 보고 싶다.",
          "care_points": ["다음 행동 변화", "신뢰와 의심의 동시 존재"],
          "rewrite_suggestion": "주인공만의 판단 방식이 대사에 더 묻어나면 더 선명하다."
        }
      ]
    },
    {
      "id": "character-relationship-bad-flat",
      "label": "자동 점수는 높지만 타깃 독자가 인물/관계에 투자하지 않은 장면",
      "genre": "mystery",
      "target_reader": "webnovel-core",
      "chapter": 4,
      "focus": {
        "character_id": "protagonist",
        "character_name": "주인공",
        "relationship_id": "protagonist_partner",
        "relationship_type": "ally",
        "counterpart_id": "partner",
        "counterpart_name": "파트너",
        "scene_promise": "주인공과 파트너가 서로를 이해하고 협력하게 된다.",
        "character_appeal_moment": "주인공은 사건 해결 의지를 보인다.",
        "relationship_turn": "파트너가 주인공을 믿기로 한다.",
        "intended_change": "둘은 함께 수사한다.",
        "consequence": "다음 사건으로 넘어간다."
      },
      "automated_score": 88,
      "expected_investing": false,
      "calibration_split": "holdout",
      "rating_scale": "likert-7",
      "reader_responses": [
        {
          "reader_id": "reader-004",
          "target_reader_fit": true,
          "ratings": {
            "protagonist_agency": 4,
            "distinctive_signature": 3,
            "vulnerability_cost": 2,
            "character_attachment": 3,
            "relationship_tension": 3,
            "reciprocal_pressure": 2,
            "subtext_inference": 3,
            "turn_consequence": 3,
            "next_scene_interest": 3
          },
          "would_follow_character": false,
          "would_follow_relationship": false,
          "would_continue_score": 3,
          "comment": "믿기로 했다는 결과만 있고 왜 마음이 바뀌었는지나 대가가 약하다.",
          "disbelief_points": ["상대의 조건이 없음", "주인공만의 매력이 흐림"],
          "rewrite_suggestion": "파트너가 거절하거나 조건을 걸고, 주인공이 잃을 정보를 내놓아야 한다."
        },
        {
          "reader_id": "reader-005",
          "target_reader_fit": true,
          "ratings": {
            "protagonist_agency": 4,
            "distinctive_signature": 3,
            "vulnerability_cost": 3,
            "character_attachment": 3,
            "relationship_tension": 3,
            "reciprocal_pressure": 3,
            "subtext_inference": 2,
            "turn_consequence": 3,
            "next_scene_interest": 3
          },
          "would_follow_character": false,
          "would_follow_relationship": false,
          "would_continue_score": 3,
          "comment": "협력은 알겠지만 둘 사이에 남는 긴장이나 다음 행동 변화가 잘 안 보인다.",
          "disbelief_points": ["숨은 속내 단서 부족", "결과가 요약처럼 느껴짐"],
          "rewrite_suggestion": "둘이 같은 목표를 가지되 서로 다른 대가를 떠안게 만들어야 한다."
        },
        {
          "reader_id": "reader-006",
          "target_reader_fit": true,
          "ratings": {
            "protagonist_agency": 3,
            "distinctive_signature": 3,
            "vulnerability_cost": 2,
            "character_attachment": 3,
            "relationship_tension": 3,
            "reciprocal_pressure": 2,
            "subtext_inference": 3,
            "turn_consequence": 3,
            "next_scene_interest": 3
          },
          "would_follow_character": false,
          "would_follow_relationship": false,
          "would_continue_score": 3,
          "comment": "주인공이 좋은 사람이라는 건 알지만 독하게 밀고 가는 선택이나 약점이 덜 보인다.",
          "disbelief_points": ["캐릭터 시그니처 행동 부족", "다음 장면 압력 부족"],
          "rewrite_suggestion": "주인공의 고유한 해결 방식이 관계를 악화시키거나 구해야 한다."
        }
      ]
    }
  ]
}
